{"acceptance_gates":[{"gate_id":"operator_runner_casing_policy_decision_required","required_before":"any runner casing equivalence or normalization claim","status":"PENDING_OPERATOR_DECISION"},{"gate_id":"runner_mutation_denied","required_before":"any repo-local runner path mutation","status":"DENIED"},{"gate_id":"traceability_audit_replay_required","required_before":"clearing the runner casing NOT_COMPUTABLE finding","status":"PENDING_AFTER_POLICY_DECISION"}],"advisory_only":true,"artifact_id":"ABX_ARTIFACT_LINEAGE_RUNNER_CASING_POLICY_REVIEW_REQUEST_001","blocked_actions":["RUNNER_CASING_POLICY_OVERRIDE","RUNNER_PATH_NORMALIZATION","SCRIPT_DISCOVERY_SEMANTICS_CHANGE","CANON_MUTATION","RUNTIME_MUTATION","QUEUE_MUTATION","SCHEDULER_MUTATION"],"canon_mutation_allowed":false,"command":"BUILD_ABX_ARTIFACT_LINEAGE_RUNNER_CASING_POLICY_REVIEW_REQUEST_001","decision_options":["KEEP_CASE_SENSITIVE_RUNNER_DISCOVERY","AUTHORIZE_CASE_INSENSITIVE_RUNNER_EQUIVALENCE_POLICY","AUTHORIZE_REPO_WIDE_RUNNER_PATH_NORMALIZATION_PLAN","REQUEST_ADDITIONAL_RUNNER_CASE_EVIDENCE"],"decision_question":"Should repo-local artifact-lineage runner discovery treat uppercase Scripts runner paths as equivalent, or should a separate governed normalization plan be authored?","downstream_status":"HELD_FOR_OPERATOR_POLICY_DECISION","execution_allowed":false,"execution_authority":false,"impacted_runner_count":478,"non_authoritative":true,"policy_review_request_only":true,"projection_only":true,"queue_mutation_allowed":false,"recommended_decision":"REQUEST_ADDITIONAL_RUNNER_CASE_EVIDENCE","recommended_next_action":"collect an explicit operator policy decision for uppercase Scripts runner discovery semantics before any runner casing equivalence, normalization, or traceability-audit clearing claim","recommended_next_lane":"ABX_ARTIFACT_LINEAGE_RUNNER_CASING_POLICY_DECISION_PLAN","request_hash":"069f4fc6d1d137b7ac2833bbe9375b8f3b9a9e8af7919e592d0d430a9720f096","required_evidence":"explicit canonical runner-path policy or case-stable lineage mapping","review_scope":"RUNNER_CASING_POLICY_DECISION_ONLY","runner_casing_policy_override_allowed":false,"runner_path_normalization_allowed":false,"runtime_mutation_allowed":false,"safe_to_auto_continue":false,"safe_to_prepare_normalization_pr":false,"sample_impacted_runners":["run_aal_viz_climate_motif_fusion_overlay.py","run_aal_viz_geometric_renderer.py","run_aal_viz_geometric_renderer_canvas.py","run_aal_viz_geometric_renderer_contract_spec.py","run_aal_viz_geometric_renderer_implementation_plan.py","run_aal_viz_geometric_renderer_planning.py","run_aal_viz_geometric_renderer_svg.py","run_aal_viz_geometric_renderer_viewmodel_adapter_spec.py","run_aal_viz_geometric_renderer_webgl.py","run_aal_viz_geometric_renderer_wp001_implementation_boundary.py","run_aal_viz_graph_render_packet.py","run_aal_viz_ingest_projection_pack.py","run_aal_viz_operator_climate_overlay.py","run_aal_viz_pressure_motif_overlay.py","run_aal_viz_runtime_projection.py","run_abx_artifact_lineage_registry_completion_plan.py","run_abx_artifact_lineage_registry_direct_repair_approval_dry_run.py","run_abx_artifact_lineage_registry_direct_repair_approval_plan.py","run_abx_artifact_lineage_registry_direct_repair_approval_validation_dry_run.py","run_abx_artifact_lineage_registry_direct_repair_approval_validation_plan.py","run_abx_artifact_lineage_registry_direct_repair_batch.py","run_abx_artifact_lineage_registry_direct_repair_completion_hold_plan.py","run_abx_artifact_lineage_registry_direct_repair_execution_authorization_gate.py","run_abx_artifact_lineage_registry_direct_repair_execution_authorization_record.py","run_abx_artifact_lineage_registry_direct_repair_final_approval_dry_run.py"],"scheduler_mutation_allowed":false,"schema_version":"AbxArtifactLineageRunnerCasingPolicyReviewRequest.v1","script_discovery_semantics_change_allowed":false,"source_traceability_audit":{"audit_id":"ABX_ARTIFACT_LINEAGE_REGISTRY_TRACEABILITY_AUDIT_001","packet_hash":"ac5ac5561ff71eba0cdeda167a04e35739a4be90210380bceb860087f53f0dd7","path":"out/sync/abx_artifact_lineage_registry_traceability_audit/latest.json","source_audit_ready":true},"status":"ABX_ARTIFACT_LINEAGE_RUNNER_CASING_POLICY_REVIEW_REQUEST_HELD","target_finding_id":"detect_uppercase_Scripts_runner_discovery_gaps","target_status":"NOT_COMPUTABLE","valid_for_execution":false,"valid_for_repair":false}
